{
  "schema_version": "recipe-draft.v1",
  "title": "삼겹살 양파볶음",
  "ingredients": [
    {
      "name": "삼겹살",
      "quantity": null,
      "unit": null,
      "evidence_step_ids": [
        "11111111-1111-4111-8111-111111111111"
      ],
      "inferred_fields": []
    },
    {
      "name": "양파",
      "quantity": "0.5",
      "unit": "개",
      "evidence_step_ids": [
        "22222222-2222-4222-8222-222222222222"
      ],
      "inferred_fields": []
    }
  ],
  "steps": [
    {
      "order": 0,
      "instruction": "삼겹살을 팬에 넣고 볶는다.",
      "evidence_step_ids": [
        "11111111-1111-4111-8111-111111111111"
      ],
      "estimated_duration_minutes": null,
      "duration_provenance": "unknown"
    },
    {
      "order": 1,
      "instruction": "양파 반 개를 넣는다.",
      "evidence_step_ids": [
        "22222222-2222-4222-8222-222222222222"
      ],
      "estimated_duration_minutes": null,
      "duration_provenance": "unknown"
    }
  ],
  "estimated_total_minutes": null,
  "estimated_time_provenance": "unknown",
  "notes": [],
  "review_flags": []
}
